{
  "schema": "org.mura.flash.inspection-recipe/v1",
  "id": "lynx-r1",
  "displayName": "Minimal fixture",
  "vendor": "Fixture",
  "models": [],
  "codenames": [],
  "builds": [],
  "evidenceLevel": "community-reported",
  "hardwareStatus": "unqualified",
  "authenticationStatus": "test-only",
  "writesEnabled": false,
  "frontends": ["python"],
  "transports": ["manual"],
  "probes": [],
  "redactFacts": [],
  "blockers": [],
  "unknowns": [],
  "sources": ["https://example.invalid/minimal"]
}
