{
  "schema": "org.mura.flash.inspection-recipe/v1",
  "id": "quest-pro-cambria",
  "displayName": "Meta Quest Pro",
  "vendor": "Meta",
  "models": ["Quest Pro"],
  "codenames": ["cambria"],
  "builds": [
    {
      "id": "52433670036000520",
      "status": "unsupported",
      "note": "Public source provides temporary post-boot root only; it does not change the persistent boot trust root."
    },
    {
      "id": "52433670048800520",
      "status": "unsupported",
      "note": "Pinned source identifies this as the first build patched against the temporary-root exploit."
    }
  ],
  "evidenceLevel": "source-documented",
  "hardwareStatus": "unsupported",
  "authenticationStatus": "test-only",
  "writesEnabled": false,
  "frontends": ["python", "webusb"],
  "transports": ["adb", "manual"],
  "probes": [
    "adb.build-fingerprint",
    "adb.build-id",
    "adb.build-incremental",
    "adb.device",
    "adb.hardware-sku",
    "adb.manufacturer",
    "adb.model",
    "adb.security-patch",
    "adb.verified-boot-state"
  ],
  "redactFacts": [],
  "blockers": [
    "No public persistent retail bootloader unlock exists.",
    "Temporary root is RAM-only and disappears fully on reboot."
  ],
  "unknowns": [
    "Persistent owner-controlled unlock mechanism and independently recoverable write boundary.",
    "Exact retail partition, rollback, and protected-state maps."
  ],
  "sources": [
    "https://github.com/Henry1887/fuguquest/tree/53cbd602d7a3978e4a5eac089096015ae756c24c"
  ]
}
